{
	"version": 1,
	"generatedAt": "2026-07-07T14:10:51.792Z",
	"sourceDir": "src/lib/assets/cats",
	"supportedPoses": ["sit"],
	"layerOrder": ["paint_splash", "body", "expression", "accessory", "misc"],
	"layers": {
		"body": [
			{
				"id": "black_sit",
				"kind": "body",
				"pose": "sit",
				"name": "Black",
				"filename": "black_sit.webp",
				"path": "src/lib/assets/cats/cats_types/black_sit.webp",
				"uiSrcKey": "cats_types/black_sit.webp",
				"tags": ["black", "sit", "body"],
				"zIndex": 20
			},
			{
				"id": "calico_sit",
				"kind": "body",
				"pose": "sit",
				"name": "Calico",
				"filename": "calico_sit.webp",
				"path": "src/lib/assets/cats/cats_types/calico_sit.webp",
				"uiSrcKey": "cats_types/calico_sit.webp",
				"tags": ["calico", "sit", "body"],
				"zIndex": 20
			},
			{
				"id": "grey_sit",
				"kind": "body",
				"pose": "sit",
				"name": "Grey",
				"filename": "grey_sit.webp",
				"path": "src/lib/assets/cats/cats_types/grey_sit.webp",
				"uiSrcKey": "cats_types/grey_sit.webp",
				"tags": ["grey", "sit", "body"],
				"zIndex": 20
			},
			{
				"id": "orange_sit",
				"kind": "body",
				"pose": "sit",
				"name": "Orange",
				"filename": "orange_sit.webp",
				"path": "src/lib/assets/cats/cats_types/orange_sit.webp",
				"uiSrcKey": "cats_types/orange_sit.webp",
				"tags": ["orange", "sit", "body"],
				"zIndex": 20
			},
			{
				"id": "siamese_sit",
				"kind": "body",
				"pose": "sit",
				"name": "Siamese",
				"filename": "siamese_sit.webp",
				"path": "src/lib/assets/cats/cats_types/siamese_sit.webp",
				"uiSrcKey": "cats_types/siamese_sit.webp",
				"tags": ["siamese", "sit", "body"],
				"zIndex": 20
			},
			{
				"id": "tabby_sit",
				"kind": "body",
				"pose": "sit",
				"name": "Tabby",
				"filename": "tabby_sit.webp",
				"path": "src/lib/assets/cats/cats_types/tabby_sit.webp",
				"uiSrcKey": "cats_types/tabby_sit.webp",
				"tags": ["tabby", "sit", "body"],
				"zIndex": 20
			},
			{
				"id": "tuxedo_sit",
				"kind": "body",
				"pose": "sit",
				"name": "Tuxedo",
				"filename": "tuxedo_sit.webp",
				"path": "src/lib/assets/cats/cats_types/tuxedo_sit.webp",
				"uiSrcKey": "cats_types/tuxedo_sit.webp",
				"tags": ["tuxedo", "sit", "body"],
				"zIndex": 20
			},
			{
				"id": "white_sit",
				"kind": "body",
				"pose": "sit",
				"name": "White",
				"filename": "white_sit.webp",
				"path": "src/lib/assets/cats/cats_types/white_sit.webp",
				"uiSrcKey": "cats_types/white_sit.webp",
				"tags": ["white", "sit", "body"],
				"zIndex": 20
			}
		],
		"expression": [
			{
				"id": "dark_happy",
				"kind": "expression",
				"pose": "sit",
				"name": "Dark Happy",
				"filename": "happy.webp",
				"path": "src/lib/assets/cats/expressions/dark_cat/happy.webp",
				"uiSrcKey": "expressions/dark_cat/happy.webp",
				"tags": ["dark", "happy", "expression"],
				"zIndex": 30
			},
			{
				"id": "dark_normal_blue",
				"kind": "expression",
				"pose": "sit",
				"name": "Dark Normal Blue",
				"filename": "normal_blue.webp",
				"path": "src/lib/assets/cats/expressions/dark_cat/normal_blue.webp",
				"uiSrcKey": "expressions/dark_cat/normal_blue.webp",
				"tags": ["dark", "normal", "blue", "expression"],
				"zIndex": 30
			},
			{
				"id": "dark_normal_green",
				"kind": "expression",
				"pose": "sit",
				"name": "Dark Normal Green",
				"filename": "normal_green.webp",
				"path": "src/lib/assets/cats/expressions/dark_cat/normal_green.webp",
				"uiSrcKey": "expressions/dark_cat/normal_green.webp",
				"tags": ["dark", "normal", "green", "expression"],
				"zIndex": 30
			},
			{
				"id": "dark_normal_orange",
				"kind": "expression",
				"pose": "sit",
				"name": "Dark Normal Orange",
				"filename": "normal_orange.webp",
				"path": "src/lib/assets/cats/expressions/dark_cat/normal_orange.webp",
				"uiSrcKey": "expressions/dark_cat/normal_orange.webp",
				"tags": ["dark", "normal", "orange", "expression"],
				"zIndex": 30
			},
			{
				"id": "dark_sad_blue",
				"kind": "expression",
				"pose": "sit",
				"name": "Dark Sad Blue",
				"filename": "sad_blue.webp",
				"path": "src/lib/assets/cats/expressions/dark_cat/sad_blue.webp",
				"uiSrcKey": "expressions/dark_cat/sad_blue.webp",
				"tags": ["dark", "sad", "blue", "expression"],
				"zIndex": 30
			},
			{
				"id": "dark_sad_green",
				"kind": "expression",
				"pose": "sit",
				"name": "Dark Sad Green",
				"filename": "sad_green.webp",
				"path": "src/lib/assets/cats/expressions/dark_cat/sad_green.webp",
				"uiSrcKey": "expressions/dark_cat/sad_green.webp",
				"tags": ["dark", "sad", "green", "expression"],
				"zIndex": 30
			},
			{
				"id": "dark_sad_orange",
				"kind": "expression",
				"pose": "sit",
				"name": "Dark Sad Orange",
				"filename": "sad_orange.webp",
				"path": "src/lib/assets/cats/expressions/dark_cat/sad_orange.webp",
				"uiSrcKey": "expressions/dark_cat/sad_orange.webp",
				"tags": ["dark", "sad", "orange", "expression"],
				"zIndex": 30
			},
			{
				"id": "dark_sleep",
				"kind": "expression",
				"pose": "sit",
				"name": "Dark Sleep",
				"filename": "sleep.webp",
				"path": "src/lib/assets/cats/expressions/dark_cat/sleep.webp",
				"uiSrcKey": "expressions/dark_cat/sleep.webp",
				"tags": ["dark", "sleep", "expression"],
				"zIndex": 30
			},
			{
				"id": "happy",
				"kind": "expression",
				"pose": "sit",
				"name": "Happy",
				"filename": "happy.webp",
				"path": "src/lib/assets/cats/expressions/happy.webp",
				"uiSrcKey": "expressions/happy.webp",
				"tags": ["happy", "expression"],
				"zIndex": 30
			},
			{
				"id": "normal_blue",
				"kind": "expression",
				"pose": "sit",
				"name": "Normal Blue",
				"filename": "normal_blue.webp",
				"path": "src/lib/assets/cats/expressions/normal_blue.webp",
				"uiSrcKey": "expressions/normal_blue.webp",
				"tags": ["normal", "blue", "expression"],
				"zIndex": 30
			},
			{
				"id": "normal_green",
				"kind": "expression",
				"pose": "sit",
				"name": "Normal Green",
				"filename": "normal_green.webp",
				"path": "src/lib/assets/cats/expressions/normal_green.webp",
				"uiSrcKey": "expressions/normal_green.webp",
				"tags": ["normal", "green", "expression"],
				"zIndex": 30
			},
			{
				"id": "normal_orange",
				"kind": "expression",
				"pose": "sit",
				"name": "Normal Orange",
				"filename": "normal_orange.webp",
				"path": "src/lib/assets/cats/expressions/normal_orange.webp",
				"uiSrcKey": "expressions/normal_orange.webp",
				"tags": ["normal", "orange", "expression"],
				"zIndex": 30
			},
			{
				"id": "sad_blue",
				"kind": "expression",
				"pose": "sit",
				"name": "Sad Blue",
				"filename": "sad_blue.webp",
				"path": "src/lib/assets/cats/expressions/sad_blue.webp",
				"uiSrcKey": "expressions/sad_blue.webp",
				"tags": ["sad", "blue", "expression"],
				"zIndex": 30
			},
			{
				"id": "sad_green",
				"kind": "expression",
				"pose": "sit",
				"name": "Sad Green",
				"filename": "sad_green.webp",
				"path": "src/lib/assets/cats/expressions/sad_green.webp",
				"uiSrcKey": "expressions/sad_green.webp",
				"tags": ["sad", "green", "expression"],
				"zIndex": 30
			},
			{
				"id": "sad_orange",
				"kind": "expression",
				"pose": "sit",
				"name": "Sad Orange",
				"filename": "sad_orange.webp",
				"path": "src/lib/assets/cats/expressions/sad_orange.webp",
				"uiSrcKey": "expressions/sad_orange.webp",
				"tags": ["sad", "orange", "expression"],
				"zIndex": 30
			},
			{
				"id": "sleep",
				"kind": "expression",
				"pose": "sit",
				"name": "Sleep",
				"filename": "sleep.webp",
				"path": "src/lib/assets/cats/expressions/sleep.webp",
				"uiSrcKey": "expressions/sleep.webp",
				"tags": ["sleep", "expression"],
				"zIndex": 30
			}
		],
		"accessory": [
			{
				"id": "bandana",
				"kind": "accessory",
				"pose": "sit",
				"name": "Bandana",
				"filename": "bandana.webp",
				"path": "src/lib/assets/cats/accessories/bandana.webp",
				"uiSrcKey": "accessories/bandana.webp",
				"tags": ["bandana", "accessory"],
				"zIndex": 40
			},
			{
				"id": "bucket_hat",
				"kind": "accessory",
				"pose": "sit",
				"name": "Bucket Hat",
				"filename": "bucket_hat.webp",
				"path": "src/lib/assets/cats/accessories/bucket_hat.webp",
				"uiSrcKey": "accessories/bucket_hat.webp",
				"tags": ["bucket", "hat", "accessory"],
				"zIndex": 40
			},
			{
				"id": "flower_corn",
				"kind": "accessory",
				"pose": "sit",
				"name": "Flower Corn",
				"filename": "flower_corn.webp",
				"path": "src/lib/assets/cats/accessories/flower_corn.webp",
				"uiSrcKey": "accessories/flower_corn.webp",
				"tags": ["flower", "corn", "accessory", "possible-typo"],
				"zIndex": 40
			},
			{
				"id": "nerd_glasses",
				"kind": "accessory",
				"pose": "sit",
				"name": "Nerd Glasses",
				"filename": "nerd_glasses.webp",
				"path": "src/lib/assets/cats/accessories/nerd_glasses.webp",
				"uiSrcKey": "accessories/nerd_glasses.webp",
				"tags": ["nerd", "glasses", "accessory"],
				"zIndex": 40
			},
			{
				"id": "sun_glasses",
				"kind": "accessory",
				"pose": "sit",
				"name": "Sun Glasses",
				"filename": "sun_glasses.webp",
				"path": "src/lib/assets/cats/accessories/sun_glasses.webp",
				"uiSrcKey": "accessories/sun_glasses.webp",
				"tags": ["sun", "glasses", "accessory"],
				"zIndex": 40
			}
		],
		"paint_splash": [],
		"misc": [
			{
				"id": "bg_park_guide",
				"kind": "misc",
				"pose": "sit",
				"name": "Bg Park Guide",
				"filename": "bg_park_guide.webp",
				"path": "src/lib/assets/cats/zzz_guide/bg_park_guide.webp",
				"uiSrcKey": "zzz_guide/bg_park_guide.webp",
				"tags": ["bg", "park", "guide", "misc"],
				"zIndex": 50
			},
			{
				"id": "cat-polaroid",
				"kind": "misc",
				"pose": "sit",
				"name": "Cat-polaroid",
				"filename": "cat-polaroid.webp",
				"path": "src/lib/assets/cats/misc/cat-polaroid.webp",
				"uiSrcKey": "misc/cat-polaroid.webp",